{"schema_version": "1", "id": "gmail-monitor", "name": "Gmail Monitor", "version": "1.0.0", "description": "Monitors Gmail", "entrypoint": "tools/", "implementation_type": "declarative", "required_integrations": ["gmail"], "required_permissions": ["gmail.read"], "tools": [{"tool_name": "search_messages", "description": "Search", "input_schema": {"type": "object"}, "risk_class": "low", "implementation_type": "declarative", "implementation_ref": "builtin.echo"}]}